173,390,2019-06-08,White Swan,Yakima County,WA,2,5,2,Shooting,,False,False,Felony,Drug trade,Residence/Other shelter,Residence,53077940003.0,-120.823037,46.422692,"James and Donovan Cloud (with the possible assistance of two others) fatally shot four victims at a residence in the Yakima Indian Reservation. They then stole a car from there and shot additional victims, killing one, inside a nearby vehicle. The murders appear to be drug related. James Cloud was convicted and Donovan Cloud pleaded guilty. James receive a life sentence and Donovan received a 327-month sentence."
174,386,2019-05-31,Virginia Beach,Virginia Beach city,VA,1,12,5,Shooting,,False,False,Public,Employment grievance,Government/Transit,Government/Transit,51810045433.0,-76.061879,36.755464,"DeWayne Craddock, a 15-year employee with no criminal history, submitted his two weeks’ notice to the Virginia Beach Municipal Government citing ""personal reasons."" According to the authorities, he then went on a rampage at work a few hours later, killing 12 and injuring five. Craddock was killed by the responding police."
175,385,2019-05-13,St. Louis,St. Louis city,MO,1,4,1,Shooting,,False,False,Unsolved,Drug trade,Residence/Other shelter,Residence,29510126900.0,-90.243408,38.677395,"Four related men were shot and killed inside an injured victim's home. The police believe the incident was related to drugs, as drugs and weapons were found in the home. The case remains unsolved. "
176,383,2019-04-28,West Chester,Butler County,OH,1,4,0,Shooting,,False,False,Family,Undetermined,Residence/Other shelter,Residence,39017011122.0,-84.467469,39.350813,"Gurpreet Singh called 911 to report that four members of his well-respected Sikh family were found shot dead in their home. Two months later he was arrested for the murder of his wife and three other relatives. The couple's three children were not at home at the time. The jury in Singh's trial could not reach a unanimous verdict, resulting in a mistrial. However, the prosecutor has vowed to retry the case. "
178,570,2019-04-11,Phoenix,Maricopa County,AZ,1,4,2,Shooting,Other,False,False,Family,Family issue,Residence/Other shelter,Residence,4013109604.0,-112.21195,33.50392,"Believing that he had permission from God, Austin Smith killed his wife (whom he suspected of infidelity), and two of his daughters. He then drove to his brother's home seeking out the man he suspected was involved with his wife. There he killed one person and injured two others who were trying to intervene. In exchange for a plea deal, Smith received a life sentence."
180,399,2019-04-01,Mandan,Morton County,ND,1,4,0,Shooting,Stabbing,False,False,Public,Undetermined,Commercial/Retail/Entertainment,Commercial/Retail,38059020301.0,-100.847931,46.814722,"Chad Isaak, a veteran and chiropractor, went to the company that managed his mobile home park and shot and stabbed four employees there. It remains unclear if he had any relationship with the victims or what the precise motive was. Isaak was convicted and sentenced to life in prison."
184,375,2019-02-16,Clinton,Hinds County,MS,1,4,0,Shooting,,False,False,Family,Undetermined,Residence/Other shelter,Residence,28049010304.0,-90.319447,32.352555,"Nam Le owned a nail salon with his wife, and several family members worked there. He shot and killed his wife, sister-in-law, sister-in-law's fiancé, and a family friend/babysitter in his home during a 12-hour standoff with police. Several hours into the standoff, he released his two children (ages 4 and 5) unharmed to the police. He was shot by a sniper and later died at the hospital. "
185,376,2019-02-15,Aurora,Kane County,IL,1,5,6,Shooting,,False,False,Public,Employment grievance,Commercial/Retail/Entertainment,Commercial/Retail,17089854700.0,-88.332726,41.756376,"Gary Martin had a long history of domestic violence, and had been in prison for stabbing an ex-girlfriend in 1995. He was able to apply successfully for an Illinois FOID (Firearm Owners Identification) card due to the lack of fingerprinting, but failed to secure a concealed carry permit. He was then sent a letter indicating that he had to give up his guns and FOID card. It remains unclear if the authorities ever followed up on his illegal gun ownership. After working at Henry Pratt company for 15 years, Martin went to a meeting where he was told he was being fired. During the meeting, he shot his boss and co-workers, and hid in the 29,000 sq. ft. factory until police found him and killed him in an exchange of gunfire. "
186,377,2019-02-11,Livingston,Polk County,TX,1,4,0,Shooting,,False,False,Family,Interpersonal conflict,Residence/Other shelter,Residence,48373210205.0,-95.056404,30.725478,"Randy Horn, an amateur boxer and poker enthusiast, allegedly killed his wife (27 years his junior), their child, and her two grandparents after posting an ominous message on Facebook. Horn took his own life."
187,380,2019-02-03,Palm Springs,Riverside County,CA,1,4,0,Shooting,,False,False,Felony,Robbery,Vehicle,Vehicle,6065044804.0,-116.506004,33.812076,"Three teenagers and a 25-year-old man were found shot along the same block, with the three teens inside a crashed car. Some evidence suggests that two of the teens may have been involved in an aborted robbery plot, but details remain unclear. According to the police, the suspect Jose Larin-Garcia  was found hiding under a pickup truck a few blocks away. He was taken for medical attention and left without the police/staff knowing. Larin-Garcia visited a friend, telling him that he had been involved in a traffic accident, and the friend loaned him money and clothing. Larin-Garcia was then arrested at a Greyhound bus station where he appeared to be inebriated. A February 2022 trial ended in a hung jury, after which the prosecution retried the case and got a conviction on four counts of first degree murder with a sentence of death. "
188,378,2019-01-26,Gonzales,Ascension Parish,LA,1,5,0,Shooting,,False,False,Family,Interpersonal conflict,Residence/Other shelter,Residence,22005030102.0,-90.892888,30.240561,"Dakota Theriot had a ""violent streak"" and a known problem with drugs. Two weeks prior to the incident, he was kicked out of his parents' trailer because of his drug problem. He then went to live with his girlfriend of a few weeks and her family. It appears that there was some sort of dispute, and he killed his girlfriend and her family (but let her two young siblings live) before stealing their car, driving to his parents’ house, and killing them. He then drove to his grandmother's home, where police apprehended him during a wellness check (she had called the police fearful that she would be the next victim of her grandson). In 2023, Theriot plead guilty to all charges and received five life sentences. "
189,381,2019-01-24,Rockmart,Polk County,GA,1,4,1,Shooting,,False,False,Family,Family issue,Residence/Other shelter,Residence,13233010600.0,-85.060432,33.999166,"While on parole, Daylon Gamble went to his estranged cousin's home. According to the police, he allegedly shot and killed his aunt and a cousin and wounded another cousin, after which he  drove to his best friend's apartment where he killed his friend and his friend's girlfriend. He then fled to Indiana where he was apprehended. Gamble was charged and is awaiting trial."
190,379,2019-01-23,Sebring,Highlands County,FL,1,5,0,Shooting,,False,False,Public,Indiscriminate,Commercial/Retail/Entertainment,Commercial/Retail,12055961304.0,-81.458393,27.470607,"Zephen Xaver had a history of being fascinated with violence, and had previously been kicked out of high school for discussing the idea of committing a school shooting, taking hostages, and dying by suicide by cop. He moved from Indiana to Florida and was living there with his mother. Xaver had dropped out of online college a month prior to the shooting and resigned his job as a correctional officer trainee two weeks prior. After allegedly killing four employees and a customer at a SunTrust Bank, Xaver called the police to let them know that he had killed five people and then barricaded himself inside the bank. Xavier was charged and is awaiting trial."
192,369,2018-12-28,St. Charles,St. Charles County,MO,1,4,1,Shooting,Stabbing,False,False,Family,Undetermined,Residence/Other shelter,Residence,29183311212.0,-90.563809,38.779914,"Richard Emery had been dating his girlfriend for approximately a year and a half. Her husband had passed away after a six-year battle with cancer about six months prior to the beginning of their relationship. He had moved into their home, and no one reported any signs of domestic violence, conflict, or mental illness. He shot and killed his girlfriend, her two children, and her mother before fleeing in a vehicle. When stopped by police, he shot at the officers and ran off on foot, attempting to carjack a woman. When her car wouldn't start, he stabbed her (nonfatally) and was eventually caught the next morning in a convenience store bathroom, suffering from two bullet wounds. Emery was arrested, convicted, and sentenced to death for the murders. "
193,370,2018-11-20,Colts Neck,Monmouth County,NJ,1,4,0,Shooting,Stabbing,False,False,Family,Profit,Residence/Other shelter,Residence,34025809902.0,-74.186886,40.32869,"Paul Caneiro killed his brother and other family members, presumably for a financial motive. The two brothers had established businesses together, but his brother was much more successful than Paul (bigger share of businesses, more money, bigger house, etc.) Several years prior to the incident, Paul was in a car accident that required multiple surgeries and caused immense emotional and physical pain (he was awarded a $120,000 settlement for his medical expenses). The once booming business that the brothers shared had fallen on tough times, and Paul’s brother had recently found out that Paul had stolen $75,000 from the business. The brother indicated that he wanted to sever his business relationship with Paul, and had sent his resume to other companies, especially looking for a job in California. Paul shot and killed his brother and his sister-in-law before stabbing their two children. He then lit their house on fire and drove home, lighting his own home on fire to make it look like a vendetta against the extended family. Caneiro has been charged and is awaiting trial."
194,368,2018-11-19,Philadelphia,Philadelphia County,PA,4,4,0,Shooting,,False,False,Felony,Drug trade,Residence/Other shelter,Residence,42101007300.0,-75.225304,39.947707,"Two stepbrothers were renovating a house when they found a small stash of drugs. One of the brothers contacted one of the offenders, attempting to sell the drugs. The offenders then attempted to rob the brothers but ended up executing everyone in the home. Four suspects were arrested, although charges against one of them were dropped. Jahlil Porter, Keith Garner, and Robert Long all pleaded guilty and were sentenced to prison."
195,367,2018-11-07,Thousand Oaks,Ventura County,CA,1,12,12,Shooting,Stabbing,False,False,Public,Indiscriminate,Commercial/Retail/Entertainment,Bar/Club/Restaurant,6111005911.0,-118.874839,34.17666,"According to the police, Ian David Long fatally shot 12 victims at the Borderline Bar and Grill in Thousand Oaks and then committed suicide. Long was an honorably discharged Marine Corps vet who moved in with his mother following the end of his service. Neighbors reported that he often fought loudly with his mother, and she had once called the police because he was acting erratically. A mental health professional who observed him following this incident suggested that he may be suffering from PTSD but declined to bring him in for further observation. Long was described as a loner by some, and a nice guy by his friends. He had previously frequented the Borderline Bar and Grill on multiple occasions. "
196,366,2018-10-27,Pittsburgh,Allegheny County,PA,1,11,6,Shooting,,False,True,Public,Hate,House of Worship,House of worship,42003140300.0,-79.920831,40.443771,"Robert Bowers was a high school dropout who started out as a conservative, but then became active in neo-Nazi circles. According to the authorities, Bowers believed in the white genocide conspiracy theory, made many antisemitic and racist remarks, and eventually shot and killed 11 people at a Pittsburgh synagogue. He was tried, convicted, and sentenced to death. "
197,365,2018-10-15,Columbia,Maury County,TN,1,4,0,Shooting,,False,False,Family,Family issue,Residence/Other shelter,Residence,47119010201.0,-87.016002,35.728768,"Cindy Collier had been married for nearly 30 years. In 2007, she separated from her husband, and raised their seven children alone (three biological and four adopted from China). She was described as a loving, Christian mother who home schooled her children. According to the police, Collier shot and killed her four adopted children before killing herself.  In the months prior, she was having arguments with her estranged husband about custody (during divorce proceedings that were later dropped). "
198,364,2018-10-13,Taft,San Patricio County,TX,2,4,1,Shooting,,False,False,Family,Interpersonal conflict,Residence/Other shelter,Residence,48409010800.0,-97.407942,27.974958,"Ronnie Rodriguez, Jr. and Sr. were at the birthday party for a one-year-old relative when they accused a man of being a peeping tom. The man then drove off, returning later with his family members. Rodriguez Jr. started shooting but missed, but then his father grabbed the gun, shooting the five men, killing four and wounding one. Rodriguez, Jr. was convicted and received a life sentence without parole, while his father's charges remain pending trial."
199,363,2018-09-12,Bakersfield,Kern County,CA,1,5,0,Shooting,,False,False,Public,Interpersonal conflict,Multiple,Multiple,6029002401.0,-118.916513,35.349566,"Javier Casarez's 28-year marriage ended four months prior when he believed that his wife was cheating on him (potentially with two of the male victims). His ex-wife claimed a history of verbal abuse, and asked for spousal and child support in addition to the family home. Casarez presumably forced his ex-wife to go to his workplace, where he killed her and two others before driving to the home of a man that had loaned him money in 2010, killing that man and his daughter. The young children in the home were unharmed. He then carjacked a mother and child, telling them that he is ""not a bad guy"" before letting them go. When confronted by police, he committed suicide. "
200,362,2018-07-27,Robstown,Nueces County,TX,1,4,0,Shooting,,False,False,Family,Interpersonal conflict,Multiple,Multiple,48355005604.0,-97.659817,27.799521,Richard Starry killed two in-laws at a home owned by himself and his father before heading to a local nursing home to kill his father and stepmother and commit suicide. Starry had served 4 years in prison for drug trafficking and had been charged with money laundering (those were dropped however). One source noted that he became a white supremacist in prison and owned 200+ guns and suggested that the motive may have been related to a property dispute between father and son.
201,361,2018-07-09,Prices Corner,New Castle County,DE,1,4,0,Shooting,,False,False,Family,Despondency,Residence/Other shelter,Residence,10003012100.0,-75.617877,39.741052,Matthew Edwards shot and killed his estranged wife and young children before committing suicide. He had recently lost his job near home and was working out of state. 
202,360,2018-06-28,Annapolis,Anne Arundel County,MD,1,5,2,Shooting,,False,False,Public,Indiscriminate,Commercial/Retail/Entertainment,Commercial/Retail,24003702702.0,-76.543573,38.994289,"In 2011, Jarrod Ramos pleaded guilty to criminal harassment of a former high school classmate, and The Capital wrote an article about it. He later filed a defamation lawsuit but lost, and began to harass the newspaper and specific employees online. He repeatedly posted threats hoping that staff members would die, and at least one staff member attempted to get a restraining order. In 2016, he ceased making threats, but then two years later came to the newspaper's office and shot five before being arrested. Ramos pleaded guilty and received a life sentence."
203,359,2018-06-11,Orlando,Orange County,FL,1,5,0,Shooting,,False,False,Family,Interpersonal conflict,Residence/Other shelter,Residence,12095014812.0,-81.465307,28.489826,"Gary Lindsey reportedly had a history of violent, erratic behavior. He was living in an apartment with his girlfriend, their two children, and her two other children. He had previously beaten her, knocked their 7-month-old out of her hands, and held a knife to her throat. Staff members from the Department of Children and Families had come to investigate several times but determined that the children were not in danger. According to the authorities, when his girlfriend next called the police to report abuse, Lindsey shot a responding officer, barricaded himself inside the apartment with the children and killed them. After a 24-hour standoff with police, Lindsey took his own life. "
204,358,2018-05-30,Scottsdale,Maricopa County,AZ,1,6,0,Shooting,,False,False,Public,Despondency,Commercial/Retail/Entertainment,Commercial/Retail,4013217201.0,-111.919298,33.49202,"Dwight Jones reportedly had a history of mental illness and domestic violence. He had used abusive language towards his son, and beat up his wife. After his arrest for domestic violence, he was court-ordered to undergo a mental health evaluation and was involuntarily committed to a behavioral health facility. Years later after his release, Jones posted a YouTube video detailing his beliefs that there was a conspiracy between his ex-wife, psychiatrist, the law firm, and the local government to keep his son away from him. According to the authorities, Jones then killed his psychiatrist, two paralegals who worked for his wife's law firm, a man who was renting the office of his son's therapist, and two friends. Jones took his own life."
205,357,2018-05-18,Santa Fe,Galveston County,TX,1,10,13,Shooting,,False,False,Public,Indiscriminate,School/College,School,48167723403.0,-95.14242,29.392283,"Dimitrios Pagourtzis, 17, allegedly fatally shot 10 (eight fellow students and two teachers) and wounded 13 others at the Santa Fe High School in Texas. Pagourtzis was ruled incompetent to stand trial."
206,356,2018-05-16,Ponder,Denton County,TX,1,4,1,Shooting,,False,False,Family,Interpersonal conflict,Residence/Other shelter,Residence,48121020314.0,-97.284581,33.178478,"Justin Painter had been married for over six years. When he filed for divorce, he obtained a temporary restraining order against his wife, was awarded primary custody of their three children, and was paid child support by his wife. It is alleged that, after failing to reconcile, Painter killed the children and his wife's boyfriend and also attempted to kill her before committing suicide. "
207,355,2018-04-22,Nashville,Davidson County,TN,1,4,4,Shooting,,False,True,Public,Indiscriminate,Commercial/Retail/Entertainment,Bar/Club/Restaurant,47037015630.0,-86.615468,36.050568,"Travis Reinking had a history of paranoia and mental illness: he believed that he was being stalked by Taylor Swift and his phone was being hacked; he crashed a pool party in a pink dress (with his rifle in the trunk) before exposing himself to the partygoers; and he attempted to break into The White House to get a meeting with President Trump. After being arrested by the Secret Service, his gun license was revoked, and the guns were turned over to his father. When he wanted to move out of state, his father returned the weapons to Reinking, who used them to kill four people at the Waffle House...while naked. He was convicted and sentenced to life without parole. "
212,354,2018-02-26,Detroit,Wayne County,MI,1,4,0,Shooting,,False,False,Family,Interpersonal conflict,Multiple,Multiple,26163544200.0,-83.265868,42.400522,"George Davis, on parole, went to a gas station in the morning and got into an argument with the mother of his child, killing her, her passenger, and another male witness. He then went to his cousin's home and killed him before fleeing; he killed himself in Ohio. "
213,353,2018-02-14,Parkland,Broward County,FL,1,17,17,Shooting,,False,False,Public,Indiscriminate,School/College,School,12011010601.0,-80.269436,26.304561," Nikolas Cruz reportedly had a history of serious mental health and behavioral problems, switching schools multiple times for disciplinary reasons. He attended specialty schools for students with emotional and behavioral problems, and had been recommended to be involuntarily committed by a SRO and counselors. After being expelled from Marjory Stoneman Douglas High School, he used an AR-15 style rifle that he had legally purchased to kill students and teachers. Cruz pleaded guilty to the murders and was sentenced to life imprisonment without parole eligibility."
214,352,2018-02-10,Paintsville,Johnson County,KY,1,4,0,Shooting,,False,False,Family,Despondency,Residence/Other shelter,Residence,21115960402.0,-82.810646,37.816206,"Joseph Nickell had recently lost his sister to drug addiction, and had a history of substance abuse and domestic violence. He drove to his parent's house, where allegedly he killed them, before attempting to kill his son. According to the authorities, Nickell then drove seven miles to his girlfriend's home and killed her and her mother before committing suicide. "
215,350,2018-01-28,Reading,Berks County,PA,4,4,0,Shooting,,False,False,Felony,Drug trade,Residence/Other shelter,Residence,42011000100.0,-75.931628,40.333087," Four young men were shot multiple times, each in a first-floor apartment of a Reading, PA row house. The case reportedly involved a drug ring. Jesus Feliciano-Trinidad, Dewayne Quinones, and Mayco Alvarez-Jackson were charged and convicted. They are awaiting sentencing.The police identified Pedro Sanchez-Laporte as a person of interest and announced a reward for information leading to his arrest. He was then arrested in Florida in 2021. Charges against Sanchez-Laporte are pending trial."
216,351,2018-01-28,Melcroft,Fayette County,PA,1,4,1,Shooting,,False,True,Public,Interpersonal conflict,Commercial/Retail/Entertainment,Commercial/Retail,42051260500.0,-79.389166,40.052003,"Timothy Smith went to a car wash in the middle of the night to engage in a fight with his ex-girlfriend's new boyfriend. While the victims believed it was supposed to be a fistfight, Smith killed them all before committing suicide. Smith was described as being obsessed with his ex. She had recently posted on Facebook that she needed to be taken out on a date or by a sniper, and Smith commented ""I can do both."" "
217,344,2017-12-31,Long Branch,Monmouth County,NJ,1,4,0,Shooting,,False,False,Family,Other,Residence/Other shelter,Residence,34025805900.0,-74.002996,40.292595,"Scott Kologi, a 16 year old who was homeschooled by his mother and reportedly had an autism spectrum disorder, killed his parents, sister, and grandfather's girlfriend in their family home on New Year's Eve. Kologi was convicted and was given four life sentences."
219,349,2017-11-14,Rancho Tehama,Tehama County,CA,1,5,18,Shooting,,False,True,Public,Indiscriminate,Multiple,Multiple,6103000300.0,-122.397512,40.001032,"Kevin Neal was suspected to be mentally ill, had just assaulted a neighbor, and was called about possible domestic violence on the day prior to the incident. According to the police, Neal shot and killed his wife before going on a rampage to kill his two neighbors, whom he suspected of cooking meth, and then stole their truck to go to the elementary school that his neighbor's son attended. He was prohibited from having guns because of the restraining order, but illegally manufactured the ghost guns at home. Neal committed suicide."
220,347,2017-11-05,Sutherland Springs,Wilson County,TX,1,25,20,Shooting,,False,True,Public,Indiscriminate,House of Worship,House of worship,48493000102.0,-98.056509,29.273245,"Devin Kelley had a history of warning signs, including domestic violence, sexual assault, prison time, military experience and obsession with weapons, obsession with previous mass shootings, restraining order, treatment in a mental health facility, etc. He went to his wife's family's church and killed 25, including her grandmother. A citizen pursued Kelley and injured him with gunfire. Kelley then crashed his car, called his family to apologize, and then took his own life. "
223,346,2017-10-11,Pedro,Lawrence County,OH,1,4,1,Shooting,Stabbing,False,False,Family,Interpersonal conflict,Residence/Other shelter,Residence,39087050700.0,-82.667385,38.630357,Arron Lawson shot and stabbed four family members and stabbed another (who survived and alerted the police). Lawson also then sexually abused one of decreased victims. Lawson pleaded guilty and was was sentenced to death.
224,345,2017-10-05,Casa Grande,Pinal County,AZ,2,4,0,Shooting,Stabbing,False,False,Other,Interpersonal conflict,Residence/Other shelter,Residence,4021001403.0,-111.75728,32.885452,"According to the police, Alec Perez had repeatedly abused his wife, and she had obtained a restraining order against him. He threatened to kill her and told her he'd be back with the right people. He and Rodney Ortiz allegedly murdered her and three others. Both have been charged with trial pending."
225,342,2017-10-01,Las Vegas,Clark County,NV,1,60,867,Shooting,,False,True,Public,Indiscriminate,Open space,Open space,32003006800.0,-115.171667,36.095,"According to the authorities, Stephen Paddock, while perched at the window of a Mandalay Bay hotel room, open fired on concert goers below, killing 60 (two of whom died years later from their injuries). Of the 867 injured victims, 411 were injured by gunfire. Paddock took his own life as police approached."
